{"session_id":"golden-session-01","asked":["q1","q2"],"last_turn":{"turn_order":1,"transcript":"For a high traffic API serving millions of requests per day I would design a two tier caching layer with Redis for hot keys and CDN edge cache for static responses. The cache invalidation strategy would use time to live of sixty seconds for volatile data and explicit purge on write for critical entities. I would handle cache stampede with request coalescing and a background refresh using a lock with five second timeout so only one worker rebuilds the entry. This approach reduced p95 latency from three hundred milliseconds to forty milliseconds in my previous role at FintechCorp while we shipped the new checkout flow for fifty thousand daily users. I also added observability with hit ratio metrics and alerts when the ratio drops below eighty percent to ensure reliability.","formatted":true,"end_of_turn":true,"end_of_turn_confidence":0.92,"words":[{"text":"For","start":125000,"end":125250,"confidence":0.92,"word_is_final":false},{"text":"a","start":125350,"end":125600,"confidence":0.9400000000000001,"word_is_final":false},{"text":"high","start":125700,"end":125950,"confidence":0.9600000000000001,"word_is_final":false},{"text":"traffic","start":126050,"end":126300,"confidence":0.92,"word_is_final":false},{"text":"API","start":126400,"end":126650,"confidence":0.9400000000000001,"word_is_final":false},{"text":"serving","start":126750,"end":127000,"confidence":0.9600000000000001,"word_is_final":false},{"text":"millions","start":127100,"end":127350,"confidence":0.92,"word_is_final":false},{"text":"of","start":127450,"end":127700,"confidence":0.9400000000000001,"word_is_final":false},{"text":"requests","start":127800,"end":128050,"confidence":0.9600000000000001,"word_is_final":false},{"text":"per","start":128150,"end":128400,"confidence":0.92,"word_is_final":false},{"text":"day","start":128500,"end":128750,"confidence":0.9400000000000001,"word_is_final":false},{"text":"I","start":128850,"end":129100,"confidence":0.9600000000000001,"word_is_final":false},{"text":"would","start":129200,"end":129450,"confidence":0.92,"word_is_final":false},{"text":"design","start":129550,"end":129800,"confidence":0.9400000000000001,"word_is_final":false},{"text":"a","start":129900,"end":130150,"confidence":0.9600000000000001,"word_is_final":false},{"text":"two","start":130250,"end":130500,"confidence":0.92,"word_is_final":false},{"text":"tier","start":130600,"end":130850,"confidence":0.9400000000000001,"word_is_final":false},{"text":"caching","start":130950,"end":131200,"confidence":0.9600000000000001,"word_is_final":false},{"text":"layer","start":131300,"end":131550,"confidence":0.92,"word_is_final":false},{"text":"with","start":131650,"end":131900,"confidence":0.9400000000000001,"word_is_final":false},{"text":"Redis","start":132000,"end":132250,"confidence":0.9600000000000001,"word_is_final":false},{"text":"for","start":132350,"end":132600,"confidence":0.92,"word_is_final":false},{"text":"hot","start":132700,"end":132950,"confidence":0.9400000000000001,"word_is_final":false},{"text":"keys","start":133050,"end":133300,"confidence":0.9600000000000001,"word_is_final":false},{"text":"and","start":133400,"end":133650,"confidence":0.92,"word_is_final":false},{"text":"CDN","start":133750,"end":134000,"confidence":0.9400000000000001,"word_is_final":false},{"text":"edge","start":134100,"end":134350,"confidence":0.9600000000000001,"word_is_final":false},{"text":"cache","start":134450,"end":134700,"confidence":0.92,"word_is_final":false},{"text":"for","start":134800,"end":135050,"confidence":0.9400000000000001,"word_is_final":false},{"text":"static","start":135150,"end":135400,"confidence":0.9600000000000001,"word_is_final":false},{"text":"responses.","start":135500,"end":135750,"confidence":0.92,"word_is_final":false},{"text":"The","start":135850,"end":136100,"confidence":0.9400000000000001,"word_is_final":false},{"text":"cache","start":136200,"end":136450,"confidence":0.9600000000000001,"word_is_final":false},{"text":"invalidation","start":136550,"end":136800,"confidence":0.92,"word_is_final":false},{"text":"strategy","start":136900,"end":137150,"confidence":0.9400000000000001,"word_is_final":false},{"text":"would","start":137250,"end":137500,"confidence":0.9600000000000001,"word_is_final":false},{"text":"use","start":137600,"end":137850,"confidence":0.92,"word_is_final":false},{"text":"time","start":137950,"end":138200,"confidence":0.9400000000000001,"word_is_final":false},{"text":"to","start":138300,"end":138550,"confidence":0.9600000000000001,"word_is_final":false},{"text":"live","start":138650,"end":138900,"confidence":0.92,"word_is_final":false},{"text":"of","start":139000,"end":139250,"confidence":0.9400000000000001,"word_is_final":false},{"text":"sixty","start":139350,"end":139600,"confidence":0.9600000000000001,"word_is_final":false},{"text":"seconds","start":139700,"end":139950,"confidence":0.92,"word_is_final":false},{"text":"for","start":140050,"end":140300,"confidence":0.9400000000000001,"word_is_final":false},{"text":"volatile","start":140400,"end":140650,"confidence":0.9600000000000001,"word_is_final":false},{"text":"data","start":140750,"end":141000,"confidence":0.92,"word_is_final":false},{"text":"and","start":141100,"end":141350,"confidence":0.9400000000000001,"word_is_final":false},{"text":"explicit","start":141450,"end":141700,"confidence":0.9600000000000001,"word_is_final":false},{"text":"purge","start":141800,"end":142050,"confidence":0.92,"word_is_final":false},{"text":"on","start":142150,"end":142400,"confidence":0.9400000000000001,"word_is_final":false},{"text":"write","start":142500,"end":142750,"confidence":0.9600000000000001,"word_is_final":false},{"text":"for","start":142850,"end":143100,"confidence":0.92,"word_is_final":false},{"text":"critical","start":143200,"end":143450,"confidence":0.9400000000000001,"word_is_final":false},{"text":"entities.","start":143550,"end":143800,"confidence":0.9600000000000001,"word_is_final":false},{"text":"I","start":145500,"end":145750,"confidence":0.92,"word_is_final":false},{"text":"would","start":145850,"end":146100,"confidence":0.9400000000000001,"word_is_final":false},{"text":"handle","start":146200,"end":146450,"confidence":0.9600000000000001,"word_is_final":false},{"text":"cache","start":146550,"end":146800,"confidence":0.92,"word_is_final":false},{"text":"stampede","start":146900,"end":147150,"confidence":0.9400000000000001,"word_is_final":false},{"text":"with","start":147250,"end":147500,"confidence":0.9600000000000001,"word_is_final":false},{"text":"request","start":147600,"end":147850,"confidence":0.92,"word_is_final":false},{"text":"coalescing","start":147950,"end":148200,"confidence":0.9400000000000001,"word_is_final":false},{"text":"and","start":148300,"end":148550,"confidence":0.9600000000000001,"word_is_final":false},{"text":"a","start":148650,"end":148900,"confidence":0.92,"word_is_final":false},{"text":"background","start":149000,"end":149250,"confidence":0.9400000000000001,"word_is_final":false},{"text":"refresh","start":149350,"end":149600,"confidence":0.9600000000000001,"word_is_final":false},{"text":"using","start":149700,"end":149950,"confidence":0.92,"word_is_final":false},{"text":"a","start":150050,"end":150300,"confidence":0.9400000000000001,"word_is_final":false},{"text":"lock","start":150400,"end":150650,"confidence":0.9600000000000001,"word_is_final":false},{"text":"with","start":150750,"end":151000,"confidence":0.92,"word_is_final":false},{"text":"five","start":151100,"end":151350,"confidence":0.9400000000000001,"word_is_final":false},{"text":"second","start":151450,"end":151700,"confidence":0.9600000000000001,"word_is_final":false},{"text":"timeout","start":151800,"end":152050,"confidence":0.92,"word_is_final":false},{"text":"so","start":152150,"end":152400,"confidence":0.9400000000000001,"word_is_final":false},{"text":"only","start":152500,"end":152750,"confidence":0.9600000000000001,"word_is_final":false},{"text":"one","start":152850,"end":153100,"confidence":0.92,"word_is_final":false},{"text":"worker","start":153200,"end":153450,"confidence":0.9400000000000001,"word_is_final":false},{"text":"rebuilds","start":153550,"end":153800,"confidence":0.9600000000000001,"word_is_final":false},{"text":"the","start":153900,"end":154150,"confidence":0.92,"word_is_final":false},{"text":"entry.","start":154250,"end":154500,"confidence":0.9400000000000001,"word_is_final":false},{"text":"This","start":154600,"end":154850,"confidence":0.9600000000000001,"word_is_final":false},{"text":"approach","start":154950,"end":155200,"confidence":0.92,"word_is_final":false},{"text":"reduced","start":155300,"end":155550,"confidence":0.9400000000000001,"word_is_final":false},{"text":"p95","start":155650,"end":155900,"confidence":0.9600000000000001,"word_is_final":false},{"text":"latency","start":156000,"end":156250,"confidence":0.92,"word_is_final":false},{"text":"from","start":156350,"end":156600,"confidence":0.9400000000000001,"word_is_final":false},{"text":"three","start":156700,"end":156950,"confidence":0.9600000000000001,"word_is_final":false},{"text":"hundred","start":157050,"end":157300,"confidence":0.92,"word_is_final":false},{"text":"milliseconds","start":157400,"end":157650,"confidence":0.9400000000000001,"word_is_final":false},{"text":"to","start":157750,"end":158000,"confidence":0.9600000000000001,"word_is_final":false},{"text":"forty","start":158100,"end":158350,"confidence":0.92,"word_is_final":false},{"text":"milliseconds","start":158450,"end":158700,"confidence":0.9400000000000001,"word_is_final":false},{"text":"in","start":158800,"end":159050,"confidence":0.9600000000000001,"word_is_final":false},{"text":"my","start":159150,"end":159400,"confidence":0.92,"word_is_final":false},{"text":"previous","start":159500,"end":159750,"confidence":0.9400000000000001,"word_is_final":false},{"text":"role","start":159850,"end":160100,"confidence":0.9600000000000001,"word_is_final":fal